direccion|precio_uf|metros_cuadrados|dormitorios|banios|latitude|longitude|url
Bulnes, Santiago, RM (Metropolitana)|3100|38|2|1|-33.4476192|-70.6537521|https://www.portalinmobiliario.com/MLC-2017354004-impecable-santiago-centro-2d1b-_JM#position=11&search_layout=grid&type=item&tracking_id=5081b875-7f14-47b9-933a-f49cbd1f6177
Avenida Vicuña Mackenna 1281, Ñuñoa, Santiago, Chile, Bogotá - Sierra Bella, Santiago, RM (Metropolitana)|2290|29|1|1|-33.4585734|-70.6295797|https://www.portalinmobiliario.com/MLC-1446593359-1-dorm-1-bano-estac-en-vicuna-con-matta-m-irarrazaval-_JM#position=32&search_layout=grid&type=item&tracking_id=3d7f6e32-fa6b-4bfe-bb60-e2ccc3d34c09
Merced, Barrio Lastarria, Santiago, RM (Metropolitana)|8700|120|2|2|-33.4369958|-70.6383921|https://www.portalinmobiliario.com/MLC-1456134721-sector-parque-forestal-ideal-inversionista-santiago-_JM#position=2&search_layout=grid&type=item&tracking_id=6b3fb110-652b-47a5-8704-cc0807131d52
Barrio San Borja, Santiago, RM (Metropolitana)|2700|46|2|1|-33.4378863|-70.6362044|https://www.portalinmobiliario.com/MLC-1477375019-departamento-a-una-cuadra-de-estacion-baquedano-_JM#position=1&search_layout=grid&type=item&tracking_id=ff92b774-f9a3-4da1-80ae-913748c65dce
Santa Isabel, Santiago, RM (Metropolitana)|3000|46|2|1|-33.44679|-70.64266|https://www.portalinmobiliario.com/MLC-1453476453-departamento-en-venta-2d-carmen-metro-santa-lucia-_JM#position=5&search_layout=grid&type=item&tracking_id=50919d6c-0457-45fd-b52c-646022aa7f6f
San Diego, Santiago, Chile, San Diego, Santiago, RM (Metropolitana)|2100|45|1|1|-33.45413|-70.6474|https://www.portalinmobiliario.com/MLC-1468530075-oportunidad-_JM#position=34&search_layout=grid&type=item&tracking_id=72e2b5c7-ee9b-47b9-b4be-5de6ade046d0
Nataniel Cox 331, Santiago, Chile, Parque Almagro, Santiago, RM (Metropolitana)|3204|65|2|1|-33.450247|-70.6533055|https://www.portalinmobiliario.com/MLC-2374886596-nataniel-urbano-dpto-1207-santiago-_JM#position=33&search_layout=grid&type=item&tracking_id=feed9058-fd81-49fc-b95e-4ff3f7520f6a
Tarapaca 876, Bulnes, Santiago, RM (Metropolitana)|2300|39|1|1|-33.4470227|-70.6484004|https://www.portalinmobiliario.com/MLC-2337344462-loft-a-la-venta-tarapaca-santiago-_JM#position=5&search_layout=grid&type=item&tracking_id=19fb1f01-4932-43df-907d-da92b14c9166
Santiago Centro, Barrio República, Santiago, RM (Metropolitana)|3650|8857|3|2|-33.4488897|-70.6692655|https://www.portalinmobiliario.com/MLC-2154782160-departamento-en-venta-de-3-dorm-en-santiago-_JM#position=39&search_layout=grid&type=item&tracking_id=8953249a-388f-48f0-8e85-4e0ca3a83c18
Sazie 2547, Barrio República, Santiago, RM (Metropolitana)|2400|45|1|1|-33.451962|-70.671829|https://www.portalinmobiliario.com/MLC-1437573845-edificio-sazie-vista-suroriente-piso-7-_JM#position=14&search_layout=grid&type=item&tracking_id=13999c8a-d1f2-4118-9b20-8e946852e19a
Santa Rosa, Barrio Diez de Julio, Santiago, RM (Metropolitana)|2201|51|2|1|-33.454079|-70.6432841|https://www.portalinmobiliario.com/MLC-1436854239-departamento-venta-de-2-dorm-en-santiago-cercano-a-metro-_JM#position=45&search_layout=grid&type=item&tracking_id=5090c801-a348-4ef4-897e-65f0e260d8b6
Granados 535, Santiago, Chile, Santa Isabel, Santiago, RM (Metropolitana)|2560|37|1|1|-33.4454916|-70.643282|https://www.portalinmobiliario.com/MLC-2109077794-lindo-departamento-en-calle-granados-metro-santa-lucia-_JM#position=46&search_layout=grid&type=item&tracking_id=a41fa647-0bae-4ea6-9ec5-79625c9e43ea
Tucapel Jiménez, Centro Histórico de Santiago, Santiago, RM (Metropolitana)|2023|40|1|1|-33.4423|-70.6592598|https://www.portalinmobiliario.com/MLC-2234396282-departamento-tucapel-jimenez-id-119943-_JM#position=21&search_layout=grid&type=item&tracking_id=c0ca3a4d-16e8-4b3e-a32c-ca17797820c3
Nataniel Cox, Parque O'Higgins, Santiago, RM (Metropolitana)|2500|37|1|1|-33.462678|-70.6515832|https://www.portalinmobiliario.com/MLC-2380384912-departamento-en-venta-de-1-dorm-en-santiago-_JM#position=38&search_layout=grid&type=item&tracking_id=897e07f3-c4af-4cb8-ad87-1246ad58dcf0
Dieciocho, Parque Almagro, Santiago, RM (Metropolitana)|2600|42|2|2|-33.4539601|-70.6565389|https://www.portalinmobiliario.com/MLC-2227188622-departamento-dieciocho-id-111590-_JM#position=33&search_layout=grid&type=item&tracking_id=d570d69c-33a2-4800-936c-b1b7af421e18
Registro Civil, Centro Histórico de Santiago, Santiago, RM (Metropolitana)|3750|63|2|0|-33.4401357|-70.6586241|https://www.portalinmobiliario.com/MLC-1440750513-departamento-en-venta-de-2-dorm-en-santiago-_JM#position=47&search_layout=grid&type=item&tracking_id=139930be-c85f-41a0-af1f-a7c904327274
Metro U De Chile, Con Terraza Amoblado, Bulnes, Santiago, RM (Metropolitana)|1800|35|1|1|-33.4463243|-70.6512816|https://www.portalinmobiliario.com/MLC-2204379396-metro-u-de-chile-con-terraza-amoblado-_JM#position=5&search_layout=grid&type=item&tracking_id=3029b441-1c74-48ca-88eb-caf6ddcbd5a9
Santa Elena 600 - 900, Santiago, Chile, Barrio Diez de Julio, Santiago, RM (Metropolitana)|3600|60|2|2|-33.453301|-70.6320899|https://www.portalinmobiliario.com/MLC-1473447451-buscar-en-stgo-centro-depto-oportunidad-privilegiado-_JM#position=5&search_layout=grid&type=item&tracking_id=4f4e1fc5-3644-4d6e-a5dc-89174a8d85c2
Teatro Teletón, Centro Histórico de Santiago, Santiago, RM (Metropolitana)|1690|29|1|1|-33.4360708|-70.6589821|https://www.portalinmobiliario.com/MLC-1455987935-departamento-en-venta-de-1-dorm-en-santiago-_JM#position=22&search_layout=grid&type=item&tracking_id=e468ac46-7985-4564-a354-7d033d847bf0
Carmen 297, Santiago, Chile, Santa Isabel, Santiago, RM (Metropolitana)|10|45|2|1|-33.4473582|-70.642332|https://www.portalinmobiliario.com/MLC-2375803934-arriendo-centrico-departamento-2d1b-en-carmen-2da-cuadra-_JM#position=8&search_layout=grid&type=item&tracking_id=bace3b35-d932-42d7-89a5-7969285f1631
Oportunidad Inversion Dpto 1 Dormitorio A Pasos Del Metro, Santa Isabel, Santiago, RM (Metropolitana)|1827|38|1|1|-33.4464266|-70.6435726|https://www.portalinmobiliario.com/MLC-2218283842-oportunidad-inversion-dpto-1-dormitorio-a-pasos-del-metro-_JM#position=10&search_layout=grid&type=item&tracking_id=bf05e5af-deb4-41cf-b5df-07ca4ec4e24d
De 3.500 Uf A 3.100 Uf, Parque Almagro, Santiago, RM (Metropolitana)|3100|65|3|2|-33.4509221|-70.650798|https://www.portalinmobiliario.com/MLC-2342229116-de-3500-uf-a-3100-uf-5868-_JM#position=14&search_layout=grid&type=item&tracking_id=aeec4c64-2f1b-4010-8dde-30ac1e686bb2
Copiapó Con Avenida Portugal, Barrio Diez de Julio, Santiago, RM (Metropolitana)|3960|65|2|2|-33.4528418|-70.6339946|https://www.portalinmobiliario.com/MLC-1445862207-departamento-en-venta-de-2-dorm-en-santiago-_JM#position=39&search_layout=grid&type=item&tracking_id=f04286ff-65e1-4cdb-bcf5-23b1c42ef423
Av. Brasil, Santiago, Chile, Barrio Brasil, Santiago, RM (Metropolitana)|2956|56|2|2|-33.4387299|-70.6646433|https://www.portalinmobiliario.com/MLC-2372404436-se-vende-depto-excelemte-estado-y-ubicacion-2d-stgo-centro-_JM#position=12&search_layout=grid&type=item&tracking_id=eb609bb0-7d42-4cfe-86bb-e04898ff9373
General Gana 1063, Torre A, Franklin - Biobío, Santiago, RM (Metropolitana)|2590|46|2|2|-33.4708256|-70.6480873|https://www.portalinmobiliario.com/MLC-1475920205-refv11475-en-venta-dp-_JM#position=42&search_layout=grid&type=item&tracking_id=345d233d-17bc-4f9e-98cc-415c0712bb97
Eleuterio Ramírez 900 - 1200, Santiago, Chile, San Diego, Santiago, RM (Metropolitana)|3225|55|2|2|-33.4491533|-70.6497087|https://www.portalinmobiliario.com/MLC-1477644017-eleuterio-ramirez-arturo-prat-_JM#position=31&search_layout=grid&type=item&tracking_id=89e952a9-a81f-45d4-83b3-f404e1f577b6
Av. Viel 1644, 8360752 Santiago, Región Metropolitana, Chile, Parque O'Higgins, Santiago, RM (Metropolitana)|2200|33|1|1|-33.4683574|-70.6564283|https://www.portalinmobiliario.com/MLC-2094136928-metro-rondizzonni-oportunidad-de-inversion-viel-1616-_JM#position=1&search_layout=grid&type=item&tracking_id=b2ec1abd-3dbc-4307-84f4-db2442c167f8
Yungay/herrera, Parque Los Reyes, Santiago, RM (Metropolitana)|2727|34|1|1|-33.4292606|-70.6793485|https://www.portalinmobiliario.com/MLC-2357137086-departamento-yungayherrera-_JM#position=14&search_layout=grid&type=item&tracking_id=1a136d2e-b24f-4d7c-b8ab-c2d2b0471a40
Zenteno - Torre Capital, Parque O'Higgins, Santiago, RM (Metropolitana)|1850|45|2|1|-33.4654041|-70.649818|https://www.portalinmobiliario.com/MLC-2117699938-departamento-zenteno-torre-capital-id-22337-_JM#position=38&search_layout=grid&type=item&tracking_id=b724bf96-7df1-4fb5-85b5-dc888222771b
Mosqueto, Centro Histórico de Santiago, Santiago, RM (Metropolitana)|2100|40|1|1|-33.4362506|-70.6445895|https://www.portalinmobiliario.com/MLC-2117725232-departamento-mosqueto-id-84810-_JM#position=13&search_layout=grid&type=item&tracking_id=860b5343-80ff-4fb0-8114-58a9f2a757f3
Lira Con Santa Isabel, Santa Isabel, Santiago, RM (Metropolitana)|2096|30|1|1|-33.4490621|-70.639387|https://www.portalinmobiliario.com/MLC-2303051280-departamento-en-venta-de-1-dorm-en-santiago-_JM#position=3&search_layout=grid&type=item&tracking_id=1e42c180-41da-4212-b00e-acbbdb134c33
Carmen 1 - 300, Santiago, Chile, Santa Isabel, Santiago, RM (Metropolitana)|3050|65|2|2|-33.4452533|-70.6429907|https://www.portalinmobiliario.com/MLC-2113984018-departamento-2-d-2-b-bod-metro-santa-lucia-_JM#position=26&search_layout=grid&type=item&tracking_id=8f23322d-dc57-45e6-8f55-f23cbf9b140a
Granados 300 - 600, Santiago, Chile, Santa Isabel, Santiago, RM (Metropolitana)|2890|43|2|1|-33.4454916|-70.643282|https://www.portalinmobiliario.com/MLC-2369927078-precioso-departamento-centro-de-santiago-_JM#position=17&search_layout=grid&type=item&tracking_id=a1fe11d2-c0d7-4352-af1c-520c9899eed7
Vicuña Mackenna, Santa Isabel, Santiago, RM (Metropolitana)|3100|50|2|1|-33.449228|-70.6320346|https://www.portalinmobiliario.com/MLC-2270500164-departamento-vicuna-mackenna-id-92968-_JM#position=48&search_layout=grid&type=item&tracking_id=d570d69c-33a2-4800-936c-b1b7af421e18
Metro Toesca, Parque Almagro, Santiago, RM (Metropolitana)|4500|60|2|2|-33.4553001|-70.6565212|https://www.portalinmobiliario.com/MLC-1442512105-metro-toesca-_JM#position=30&search_layout=grid&type=item&tracking_id=ad89b61c-35d9-4370-9a9f-5c52e7f12fa2
Santo Domingo Con Amunategui, Centro Histórico de Santiago, Santiago, RM (Metropolitana)|1980|33|1|1|-33.4372474|-70.6563935|https://www.portalinmobiliario.com/MLC-1475255179-departamento-en-venta-de-1-dorm-santiago-_JM#position=32&search_layout=grid&type=item&tracking_id=8c555f80-a5b5-4edc-a367-4bf34d2a90d0
Santo Domingo Esquina Teatinos, Centro Histórico de Santiago, Santiago, RM (Metropolitana)|1928|45|1|1|-33.4368092|-70.6563592|https://www.portalinmobiliario.com/MLC-1472916605-dpto-venta-un-dorm-un-bano-piso-alto-vista-desejada-_JM#position=42&search_layout=grid&type=item&tracking_id=8c555f80-a5b5-4edc-a367-4bf34d2a90d0
San Diego / General Gana, Franklin - Biobío, Santiago, RM (Metropolitana)|1390|26|1|1|-33.4700891|-70.6478199|https://www.portalinmobiliario.com/MLC-2326599952-departamento-en-venta-en-santiago-_JM#position=12&search_layout=grid&type=item&tracking_id=eea918e5-ee32-469b-8390-edf757239b31
Santa Isabel, Santiago, RM (Metropolitana)|2000|36|1|1|-33.445638|-70.645078|https://www.portalinmobiliario.com/MLC-1452770853-venta-departamento-santa-rosa-santa-lucia-_JM#position=25&search_layout=grid&type=item&tracking_id=0b042aba-594b-4c16-97f8-db33c237c16a
Eleuterio Ramírez 835, 8320000 Santiago, Región Metropolitana, Chile, Bulnes, Santiago, RM (Metropolitana)|4480|78|3|2|-33.4482472|-70.6477134|https://www.portalinmobiliario.com/MLC-1478354065-departamento-remodelado-en-la-mejor-ubicacion-de-santiago-_JM#position=44&search_layout=grid&type=item&tracking_id=a68ff074-f63f-473d-989f-fc0b4c4b2072
Plaza De Bolsillo, Centro Histórico de Santiago, Santiago, RM (Metropolitana)|2350|52|2|2|-33.4367649|-70.6548365|https://www.portalinmobiliario.com/MLC-1457861251-departamento-en-venta-de-2-dorm-en-santiago-_JM#position=8&search_layout=grid&type=item&tracking_id=70171495-6ecf-41cc-9b60-37e09ca4a4d2
Frente Al Parque De La Familia / Cueto, Parque Los Reyes, Santiago, RM (Metropolitana)|3537|58|2|1|-33.427682|-70.6744235|https://www.portalinmobiliario.com/MLC-2240001480-venta-de-2-dorm-con-estacionamiento-y-bodega-en-santiago-_JM#position=28&search_layout=grid&type=item&tracking_id=a98e79ca-dc2b-4ac9-bc8f-48ab6449071e
En Venta Departamento/oficina A Pasos De Estación Metro Moneda, Centro Histórico de Santiago, Santiago, RM (Metropolitana)|3090|138|4|2|-33.4427989|-70.6562925|https://www.portalinmobiliario.com/MLC-2299554856-departamento-en-venta-en-santiago-_JM#position=40&search_layout=grid&type=item&tracking_id=b1d873fb-aff6-4adb-ab65-ba5a75f26ed0
Cienfuegos 81, Santiago, Chile, Barrio Brasil, Santiago, RM (Metropolitana)|2956|70|3|2|-33.4438226|-70.6630619|https://www.portalinmobiliario.com/MLC-1441961589-oportunidad-rebajado-cienfuegos-3d2b1e-_JM#position=18&search_layout=grid&type=item&tracking_id=4a51204c-365c-4ce5-babb-b938692704ae
Cerro Santa Lucia, Centro Histórico de Santiago, Santiago, RM (Metropolitana)|2203|57|2|1|-33.4396497|-70.6466476|https://www.portalinmobiliario.com/MLC-1445122603-departamento-en-venta-de-2-dorm-en-santiago-_JM#position=8&search_layout=grid&type=item&tracking_id=ecdb45d2-9a53-4d84-9596-557b47614778
Fray Camilo Henríquez 686, Santiago, Chile, Barrio Diez de Julio, Santiago, RM (Metropolitana)|2929|50|3|2|-33.4511456|-70.6332743|https://www.portalinmobiliario.com/MLC-2239043152-fray-camilo-henriquez-irarrazaval-_JM#position=17&search_layout=grid&type=item&tracking_id=4f4e1fc5-3644-4d6e-a5dc-89174a8d85c2
Avenida Portugal, Santiago, Chile, Barrio Diez de Julio, Santiago, RM (Metropolitana)|1900|38|1|1|-33.4559549|-70.6333543|https://www.portalinmobiliario.com/MLC-1473432565-depto-ubicado-cercano-a-metro-_JM#position=33&search_layout=grid&type=item&tracking_id=0c74d70a-9da3-4212-af63-f5a99a627245
Lord Cochrane Con Eleuterio Ramírez, Parque Almagro, Santiago, RM (Metropolitana)|3228|60|2|2|-33.4504443|-70.6544387|https://www.portalinmobiliario.com/MLC-2276304886-depto-1315-2-dormitorios-2-banos-metro-moneda-_JM#position=21&search_layout=grid&type=item&tracking_id=ad89b61c-35d9-4370-9a9f-5c52e7f12fa2
Condominio, Barrio Yungay, Santiago, RM (Metropolitana)|2015|49|2|1|-33.4360276|-70.6727735|https://www.portalinmobiliario.com/MLC-1469541279-departamento-en-venta-de-2-dorm-san-pablo-en-santiago-_JM#position=4&search_layout=grid&type=item&tracking_id=da4bba1b-0849-4dc7-a699-7f14cdbb36d3
Portugal 968, Barrio Diez de Julio, Santiago, RM (Metropolitana)|2640|42|2|1|-33.45472|-70.63356|https://www.portalinmobiliario.com/MLC-2085739786-edificio-portugal-piso-2-_JM#position=38&search_layout=grid&type=item&tracking_id=4f4e1fc5-3644-4d6e-a5dc-89174a8d85c2
Lord Cochrane N 209, Santiago, Chile, Bulnes, Santiago, RM (Metropolitana)|2042|45|2|1|-33.4493353|-70.6549473|https://www.portalinmobiliario.com/MLC-2275335292-hermoso-entrega-inmediata-_JM#position=15&search_layout=grid&type=item&tracking_id=5991b0a2-9c87-4b6d-a62d-b9638dc74856
Grajales, 800, Barrio República, Santiago, RM (Metropolitana)|2600|30|1|1|-33.4526516|-70.669541|https://www.portalinmobiliario.com/MLC-2321740468-venta-departamento-1hab-1ba-estacion-central-_JM#position=37&search_layout=grid&type=item&tracking_id=00c1dc4f-c55a-480c-aac4-7759a2d54f8a
Cabo Arestey 1 - 300, Santiago, Región Metropolitana, Chile, Barrio República, Santiago, RM (Metropolitana)|2550|54|2|2|-33.4497204|-70.6701909|https://www.portalinmobiliario.com/MLC-1447425851-amplio-2do-dormcocina-cerrada-novacion-a-excelente-tasa-_JM#position=35&search_layout=grid&type=item&tracking_id=13999c8a-d1f2-4118-9b20-8e946852e19a
|0|0|0|0|||https://www.portalinmobiliario.com/MLC-2337154346-departamento-costado-metro-santa-ana-comuna-de-santiago-_JM#position=38&search_layout=grid&type=item&tracking_id=9b63cc9a-bb9f-4622-af73-96d5c6576b07
Amunátegui 661, 8340262 Santiago, Región Metropolitana, Chile, Centro Histórico de Santiago, Santiago, RM (Metropolitana)|1650|26|0|1|-33.436157|-70.6571018|https://www.portalinmobiliario.com/MLC-1477116071-departamento-estudio-a-pasos-del-metro-santa-ana-_JM#position=10&search_layout=grid&type=item&tracking_id=ae1335c0-532c-4857-990d-ae7ab8932df4
Santo Domingo/ Amunategui, Centro Histórico de Santiago, Santiago, RM (Metropolitana)|4400|83|2|2|-33.4364439|-70.6561147|https://www.portalinmobiliario.com/MLC-2299591630-venta-departamento-2-dorm-2-banos-en-santiago-_JM#position=26&search_layout=grid&type=item&tracking_id=051b4ada-34bb-4aee-88b0-2b4f22f6e389
Tarapacá 1331, Santiago, Chile, Bulnes, Santiago, RM (Metropolitana)|2500|59|2|2|-33.4477138|-70.6539794|https://www.portalinmobiliario.com/MLC-2060799876-2d-2b-en-tarapaca-1331-santiago-metro-la-moneda-_JM#position=41&search_layout=grid&type=item&tracking_id=dd130a03-46fa-4ccd-b0ee-25e6c9cee5a7
Lira / Curicó /hospital Clínico Universidad Católica, Santa Isabel, Santiago, RM (Metropolitana)|3800|55|2|1|-33.4445103|-70.6403147|https://www.portalinmobiliario.com/MLC-1472545895-a-pasos-metro-u-catolica-con-estacionamiento-y-bodega-_JM#position=2&search_layout=grid&type=item&tracking_id=50919d6c-0457-45fd-b52c-646022aa7f6f
San Diego, Parque O'Higgins, Santiago, RM (Metropolitana)|2050|38|2|1|-33.4652784|-70.6490192|https://www.portalinmobiliario.com/MLC-2076711600-departamento-san-diego-id-113862-_JM#position=18&search_layout=grid&type=item&tracking_id=156d961a-2fc1-4934-b172-d3b22e115faa
Toesca 1929, Santiago, Chile, Ejército - Toesca, Santiago, RM (Metropolitana)|1960|29|1|1|-33.4532895|-70.6619487|https://www.portalinmobiliario.com/MLC-2157423010-leiva-pro-vende-depto-1-dor-toesca-stgo-oportunidad--_JM#position=37&search_layout=grid&type=item&tracking_id=b05586f8-2e03-41b0-89b8-331f8affd440
Avenida Santa Rosa, San Diego, Santiago, RM (Metropolitana)|1800|25|1|1|-33.4485677|-70.6452174|https://www.portalinmobiliario.com/MLC-2195348936-departamento-avenida-santa-rosa-id-110864-_JM#position=32&search_layout=grid&type=item&tracking_id=633394a1-3e6d-4422-9190-7d8676bf0a16
Metro Moneda, Parque Almagro, Santiago, RM (Metropolitana)|2300|40|1|1|-33.4504307|-70.6562309|https://www.portalinmobiliario.com/MLC-2381842428-metro-moneda-_JM#position=28&search_layout=grid&type=item&tracking_id=f84434bd-34c7-4ec3-890a-7a818ed850a6
Virreinato, Santa Isabel, Santiago, RM (Metropolitana)|2950|54|2|1|-33.4493304|-70.631886|https://www.portalinmobiliario.com/MLC-2344103042-virreinato-21672-_JM#position=19&search_layout=grid&type=item&tracking_id=cf3f9c9b-80d4-4ba6-8d76-38fcbbfa7258
Raulí 596, Santiago, Chile, Santa Isabel, Santiago, RM (Metropolitana)|3420|80|3|2|-33.4496342|-70.6364344|https://www.portalinmobiliario.com/MLC-2355097086-amplio-dpto-3d2b-excelente-ubicacion-metro-sta-isabel-_JM#position=36&search_layout=grid&type=item&tracking_id=6f016e3d-3959-473d-ae51-0ff529e9c633
Diagonal Vicuña Mackenna 2004, Santiago, Chile, Bogotá - Sierra Bella, Santiago, RM (Metropolitana)|3400|55|2|2|-33.4700254|-70.6258256|https://www.portalinmobiliario.com/MLC-1451038771-jardines-de-vicuna-2d2b-estilo-mariposa-metro-nuble-_JM#position=3&search_layout=grid&type=item&tracking_id=1feaef49-5309-41cc-939b-0b2cd2306cac
Huérfanos 1200 - 1500, Santiago, Chile, Centro Histórico de Santiago, Santiago, RM (Metropolitana)|1867|33|1|1|-33.4403546|-70.6567062|https://www.portalinmobiliario.com/MLC-2315251280-metro-moneda-gran-vista-despejada-_JM#position=12&search_layout=grid&type=item&tracking_id=3699db9e-8e7e-4aa9-8e0a-fe4f61e1f83b
Eyzaguirre, Parque O'Higgins, Santiago, RM (Metropolitana)|1750|29|1|1|-33.4612539|-70.6514485|https://www.portalinmobiliario.com/MLC-1437366191-venta-departamento-santiago-de-1-dormitorio-_JM#position=3&search_layout=grid&type=item&tracking_id=221b4f95-b050-4621-8c6f-e63e754a5487
Santo Domingo, Centro Histórico de Santiago, Santiago, RM (Metropolitana)|3650|50|1|1|-33.4373391|-70.657814|https://www.portalinmobiliario.com/MLC-2117686906-departamento-santo-domingo-id-32761-_JM#position=46&search_layout=grid&type=item&tracking_id=9edf42cc-b6d9-4871-ad16-be4d2119ff26
General Mackenna 900 - 1200, Santiago, Chile, Centro Histórico de Santiago, Santiago, RM (Metropolitana)|1730|50|2|1|-33.4334388|-70.6538145|https://www.portalinmobiliario.com/MLC-1476805879-oportunidad-g-mackenna-a-pasos-metro-cal-y-canto-2d-1b-_JM#position=33&search_layout=grid&type=item&tracking_id=70171495-6ecf-41cc-9b60-37e09ca4a4d2
Metro Parque Almagro / Santiago Centro, San Diego, Santiago, RM (Metropolitana)|2090|37|1|1|-33.4490654|-70.6457212|https://www.portalinmobiliario.com/MLC-2357660928-inversion-arrendado-casi-nuevo-_JM#position=44&search_layout=grid&type=item&tracking_id=b6b4d04f-7990-445d-a5ec-51f01f59d8d1
Departamento En Venta De 1 Dorm. En Santiago, San Diego, Santiago, RM (Metropolitana)|1695|56|1|1|-33.4521051|-70.6458899|https://www.portalinmobiliario.com/MLC-1475447211-departamento-en-venta-de-1-dorm-en-santiago-_JM#position=37&search_layout=grid&type=item&tracking_id=19c2411a-352c-4da1-8518-8ed69b0a4822
San Diego 1721, Parque O'Higgins, Santiago, RM (Metropolitana)|2817|43|2|2|-33.4687803|-70.6490745|https://www.portalinmobiliario.com/MLC-2369869286-refv1022-en-venta-para-inversion-o-vivienda-propi-_JM#position=1&search_layout=grid&type=item&tracking_id=92e60104-7d52-460c-8ad7-967871aeb542
Curico Con Vicuña Mackenna, Santa Isabel, Santiago, RM (Metropolitana)|2200|28|1|1|-33.4443636|-70.6353655|https://www.portalinmobiliario.com/MLC-1453086385-curico-con-vicuna-mackenna-_JM#position=17&search_layout=grid&type=item&tracking_id=3978bf09-3ea8-4347-90e7-66a17aa31072
Arturo Prat, 636, San Diego, Santiago, RM (Metropolitana)|3400|47|2|1|-33.453022|-70.648405|https://www.portalinmobiliario.com/MLC-2388701522-departamento-2d1b1estc1bdga-en-stgo-centro-_JM#position=47&search_layout=grid&type=item&tracking_id=21a7b49d-9a90-4875-b5af-f4802f43c525
Avenida Almirante Blanco Encalada 1723, Santiago, Chile, Ejército - Toesca, Santiago, RM (Metropolitana)|2230|38|1|1|-33.4563026|-70.6580438|https://www.portalinmobiliario.com/MLC-2385871508-depto-1d1b-buena-conectividad-metro-toesca-y-p-ohiggins-_JM#position=46&search_layout=grid&type=item&tracking_id=0aca173a-8391-45d9-af8f-2b97882ec3d4
Metro Santa Ana, Centro Histórico de Santiago, Santiago, RM (Metropolitana)|1600|35|1|1|-33.4380944|-70.6575077|https://www.portalinmobiliario.com/MLC-2369340020-departamento-en-venta-de-1-dorm-en-santiago-_JM#position=46&search_layout=grid&type=item&tracking_id=34983efa-9680-42f4-9f81-377a79c05b49
Gran Oportunidad Para Inversionistas, San Diego, Santiago, RM (Metropolitana)|1398|20|1|1|-33.452301|-70.645897|https://www.portalinmobiliario.com/MLC-1455122389-gran-oportunidad-para-inversionistas-_JM#position=27&search_layout=grid&type=item&tracking_id=19c2411a-352c-4da1-8518-8ed69b0a4822
Vendo Departamento En Lord Cochrane, Parque O'Higgins, Santiago, RM (Metropolitana)|2685|52|2|2|-33.4613067|-70.6532446|https://www.portalinmobiliario.com/MLC-2342292526-vendo-departamento-en-lord-cochrane-19122-_JM#position=48&search_layout=grid&type=item&tracking_id=b2ec1abd-3dbc-4307-84f4-db2442c167f8
Pedro Lagos 1000, Parque O'Higgins, Santiago, RM (Metropolitana)|2700|75|3|1|-33.4661432|-70.6471388|https://www.portalinmobiliario.com/MLC-1473139185-pedro-lagos-1000-_JM#position=5&search_layout=grid&type=item&tracking_id=c273fbd6-b709-4412-9c1d-d22dd3c0c8e5
Portugal 941, Santiago, Chile, Barrio Diez de Julio, Santiago, RM (Metropolitana)|3260|37|1|1|-33.4544487|-70.6338883|https://www.portalinmobiliario.com/MLC-2364006176-se-vende-excelente-departamento-1d1b-metro-irarrazabal-_JM#position=42&search_layout=grid&type=item&tracking_id=5090c801-a348-4ef4-897e-65f0e260d8b6
Mapocho/ Chacabuco, Parque Los Reyes, Santiago, RM (Metropolitana)|3700|47|2|1|-33.4325753|-70.6796123|https://www.portalinmobiliario.com/MLC-2352608212-venta-departamento-q-normal-2-dormitorios1bano-estacionam-_JM#position=7&search_layout=grid&type=item&tracking_id=030364f5-77bc-491f-b366-9b2612cd13f0
Parque O'Higgins, Santiago, RM (Metropolitana)|2180|45|2|1|-33.468869|-70.654287|https://www.portalinmobiliario.com/MLC-2162708692-departamento-2-dormitorios-metro-rondizzoni-_JM#position=7&search_layout=grid&type=item&tracking_id=156d961a-2fc1-4934-b172-d3b22e115faa
Huerfanos, 1400, Centro Histórico de Santiago, Santiago, RM (Metropolitana)|2700|50|2|2|-33.440222|-70.656696|https://www.portalinmobiliario.com/MLC-1478379757-departamento-en-venta-2d-2b-calle-huerfanos-_JM#position=6&search_layout=grid&type=item&tracking_id=22c846a4-8db2-4cdf-9360-cb3db1e09ce6
Sector La Moneda, Bulnes, Santiago, RM (Metropolitana)|2497|34|1|1|-33.4489704|-70.6559288|https://www.portalinmobiliario.com/MLC-2382993326-sector-la-moneda-_JM#position=11&search_layout=grid&type=item&tracking_id=cb989e76-6b87-4c2f-a702-bd2fce358c1a
José Miguel Carrera, Ejército - Toesca, Santiago, RM (Metropolitana)|4700|78|3|2|-33.4549981|-70.6629922|https://www.portalinmobiliario.com/MLC-1442314223-departamento-jose-miguel-carrera-id-43304-_JM#position=45&search_layout=grid&type=item&tracking_id=14e0d470-229c-4585-a472-1cb8dec6b125
Zenteno / Pedro Lagos / San Diego, Parque O'Higgins, Santiago, RM (Metropolitana)|1478|39|2|1|-33.4656243|-70.6498174|https://www.portalinmobiliario.com/MLC-2355046418-departamento-en-venta-en-santiago-_JM#position=17&search_layout=grid&type=item&tracking_id=0b350ee6-003c-46f8-a149-4d5d91ea2137
Santa Isabel/san Francisco, San Diego, Santiago, RM (Metropolitana)|1209|20|1|1|-33.4520785|-70.6460952|https://www.portalinmobiliario.com/MLC-1475375925-departamento-santa-isabelsan-francisco-_JM#position=35&search_layout=grid&type=item&tracking_id=31dba42f-d1f5-4994-b25d-c82b3973d5dd
